{"bindings":{"dependency_lock_sha256":"sha256:e8a6a0abaddf17d957e38e725f9406bfe20d6dcd116b225de6f4d1dbf4c9867f","profile_sha256":"sha256:a6970e5768b8af1c64079e0d1cfd25e218a4069f59e3b0a3a857c1b63d16c6fa","raw_output_sha256":"sha256:8b538b81d689644b296f3e7c16656897bd4b345c043c260f9dc6c263219e8afd","runner_sha256":"sha256:f6cd67e17bbfa1257c7e8db42bb3cb2637312da55def2c0f5f1f0484d1be9c4e","schedule_sha256":"sha256:954277456a15228be6df8034691d51f24fe37cb48e0a3fbbc4398467e567344c"},"format":"invarlock/evaluator-qualification-export-v1","profile_id":"lm-evaluation-harness","records":[{"input_sha256":"sha256:115049a298532be2f181edb03f766770c0db84c22aff39003fec340deaec7545","output_sha256":"sha256:5dd272b4f316b776a7b8e3d0894b37e1e42be3d5d3b204b8a5836cc50597a6b1","output_text":"Paris","record_id":"record-1","reported_score":1.0,"status":"ok"},{"input_sha256":"sha256:c129c5d146924f88a7141d71f50308ac2c04164852652a1e0d02622c24b83a7a","output_sha256":"sha256:dda18a0e21ae47c53b4309434cbc02ae8bf764fa83a6defbb719431242722aa7","output_text":"candidate","record_id":"record-2","reported_score":0.0,"status":"ok"}],"summary":null,"upstream":{"ecosystem":"pypi","name":"lm-eval","version":"0.4.12"}}
