{"bindings":{"dependency_lock_sha256":"sha256:3925ec2d7a9299e035bf281737e1beea54053a783cc2682510b2c80f7c8d8f6b","profile_sha256":"sha256:faccdff0b08fc99048554fc8009c209764849d68bf27924cf58a9eeace3fd455","raw_output_sha256":"sha256:b76ac210eb7282888d2410dfc7346d4530e370b29e41184668a67db1789d72f6","runner_sha256":"sha256:35acd92c195070630e5e155ef2a427220632c3fe99202f57519925f97ec701a8","schedule_sha256":"sha256:954277456a15228be6df8034691d51f24fe37cb48e0a3fbbc4398467e567344c"},"format":"invarlock/evaluator-qualification-export-v1","profile_id":"openai-evals","records":[{"input_sha256":"sha256:115049a298532be2f181edb03f766770c0db84c22aff39003fec340deaec7545","output_sha256":"sha256:5dd272b4f316b776a7b8e3d0894b37e1e42be3d5d3b204b8a5836cc50597a6b1","output_text":"Paris","record_id":"record-1","reported_score":1.0,"status":"ok"},{"input_sha256":"sha256:c129c5d146924f88a7141d71f50308ac2c04164852652a1e0d02622c24b83a7a","output_sha256":"sha256:dda18a0e21ae47c53b4309434cbc02ae8bf764fa83a6defbb719431242722aa7","output_text":"candidate","record_id":"record-2","reported_score":0.0,"status":"ok"}],"summary":null,"upstream":{"ecosystem":"pypi","name":"evals","version":"3.0.1.post1"}}
