{"bindings":{"dependency_lock_sha256":"sha256:13a6369c75f71692bae0222514bd3ff874e605f01667d09e907a09bc09d2b07b","profile_sha256":"sha256:c25bef6b1d3ea991e5758b0dc00be0fbf94c1ec9036f73c568441dfc6d79571b","raw_output_sha256":"sha256:9eb223d97ce6a565798ccccb0d6876d0390d4ae9659b8bc3ef996a7eef41ed51","runner_sha256":"sha256:52a6e1d9b7fd2c22b386992a1f942e7645ba1d6b33554ed1dff8c35e3123032a","schedule_sha256":"sha256:954277456a15228be6df8034691d51f24fe37cb48e0a3fbbc4398467e567344c"},"format":"invarlock/evaluator-qualification-export-v1","profile_id":"garak","records":[],"summary":{"kind":"unsupported_semantics","sha256":"sha256:9eb223d97ce6a565798ccccb0d6876d0390d4ae9659b8bc3ef996a7eef41ed51"},"upstream":{"ecosystem":"pypi","name":"garak","version":"0.15.1"}}
